bin_id,location,waste_level,status,last_updated,temperature,bin_type,capacity,daily_average_waste,collection_frequency,latitude,longitude,contact
BIN_1,"Nairobi, Westlands, Parklands, The Sarit Centre",0,Empty,2025-01-04 18:49:41.424032,18.27,Organic,78,19.23,35,-1.262186,36.805055,cliffordmukosh@gmail.com
BIN_3,"Kisumu, Milimani, Oginga Odinga Street, Kisumu Mall",70,Empty,2025-01-02 18:49:41.424092,35.59,Paper,126,6.83,12,-0.091702,34.767957,cliffordmukosh@gmail.com
BIN_4,"Nakuru, Kiamunyi, Kenyatta Avenue, Nakuru Building",10,Half Full,2024-12-31 19:49:41.424103,18.1,Paper,107,11.63,15,-0.285236,36.071958,cliffordmukosh@gmail.com
BIN_6,"Nairobi, Pangani, Moi Avenue, Pangani Building",10,Full,2025-01-03 23:49:41.424124,35.24,Metal,81,16.14,15,-1.283253,36.828711,cliffordmukosh@gmail.com
Incididunt non facil,"Baawa ward, Samburu Central, Samburu, Rift Valley, Kenya",83,inactive,2025-01-11 04:43:51,16,recyclable,37,64,66,1.2842601884992975,36.81904792785645,cliffordmukosh@gmail.com
